{
  "$schema": "../schema.json",
  "pid": "PID->PythonScript",
  "name": "Python Script",
  "description": "This Operation Type Profile is used to describe how to execute a Python script.",
  "createdAt": "2024-02-05T12:00:00Z",
  "license": "https://creativecommons.org/licenses/by/4.0/",
  "contributors": [
    {
      "type": "ORCiD",
      "url": "https://orcid.org/0009-0005-2800-4833"
    }
  ],
  "adapters": [
    "PID -> PythonExec",
    "PID -> JSPyScript",
    "PID -> WASM"
  ],
  "attributes": [
    {
      "pid": "PID->URL",
      "name": "Script Location",
      "description": "The location of the Python script.",
      "obligation": "Mandatory"
    },
    {
      "pid": "PID->String",
      "name": "Entry point",
      "description": "The entry point of the Python script.",
      "obligation": "Mandatory"
    },
    {
      "pid": "PID->KVPair",
      "name": "Attribute",
      "description": "An attribute (key-value pair) to be passed to the Python script.",
      "obligation": "Optional"
    }
  ]
}